[
  {"id":"order_sample_001","cargoId":"cargo_electronics_001","originCityId":"city_nanyang_001","destinationCityId":"city_zhengzhou_001","weightKg":620,"volumeLiters":3600,"rewardCents":248000,"availableAt":0,"deadlineAt":21600,"status":"available"},
  {"id":"order_sample_002","cargoId":"cargo_express_001","originCityId":"city_nanyang_001","destinationCityId":"city_wuhan_001","weightKg":480,"volumeLiters":4200,"rewardCents":326000,"availableAt":0,"deadlineAt":28800,"status":"available"},
  {"id":"order_sample_003","cargoId":"cargo_auto_parts_001","originCityId":"city_zhengzhou_001","destinationCityId":"city_nanyang_001","weightKg":870,"volumeLiters":1900,"rewardCents":219000,"availableAt":0,"deadlineAt":25200,"status":"available"},
  {"id":"order_sample_004","cargoId":"cargo_furniture_001","originCityId":"city_wuhan_001","destinationCityId":"city_changsha_001","weightKg":760,"volumeLiters":6100,"rewardCents":274000,"availableAt":0,"deadlineAt":27000,"status":"available"}
]
